<!ELEMENT catalogo (producto+)>
<!ELEMENT producto (nombre, marca, precio, contenidoFructosa, apto)>
<!ELEMENT nombre (#PCDATA)>
<!ELEMENT marca (#PCDATA)>
<!ELEMENT precio (#PCDATA)>
<!ELEMENT contenidoFructosa (#PCDATA)>
<!ELEMENT apto (#PCDATA)>